{
  "$schema": "https://json-schema.org/draft/2020-12/schema",
  "title": "CronJob",
  "type": "object",
  "required": ["id", "name", "schedule", "task", "status", "createdAt", "updatedAt"],
  "properties": {
    "id": { "type": "string" },
    "name": { "type": "string" },
    "schedule": {
      "type": "string",
      "description": "Execution schedule. User-entered one-time and daily schedules are interpreted as CST (UTC+8) at creation and stored in UTC as YYYY-MM-DD HH:mm or daily HH:mm; cron expressions are stored unchanged."
    },
    "task": { "type": "string" },
    "taskType": {
      "type": "string",
      "description": "Runtime task type created by the schedule. Code schedules default to code.task; legacy code.claude_code_task records remain accepted."
    },
    "targetAgent": { "type": "string" },
    "targetAgentId": { "type": "string" },
    "workspacePath": { "type": "string" },
    "payload": {
      "type": "object",
      "additionalProperties": true
    },
    "notifyTarget": {
      "type": "object",
      "description": "Optional channel notification target copied onto scheduled RuntimeTasks and used for schedule failure notifications.",
      "required": ["channel", "accountId", "conversationId", "messageType"],
      "properties": {
        "channel": { "type": "string" },
        "accountId": { "type": "string" },
        "conversationId": { "type": "string" },
        "senderId": { "type": "string" },
        "messageType": { "type": "string", "enum": ["dm", "group", "guild", "system"] }
      }
    },
    "status": { "type": "string", "enum": ["active", "paused"] },
    "misfirePolicy": {
      "type": "string",
      "enum": ["skip", "run_once", "catch_up_limited"],
      "description": "How due-job scans handle missed schedule ticks. Defaults to run_once for new records."
    },
    "concurrencyKey": {
      "type": "string",
      "description": "Optional duplicate-prevention key. Goal scans derive goal.cron_scan:<goalType>:<action>; PR pool scans derive prpool:<taskType>:<id>."
    },
    "lastSkippedAt": { "type": "string" },
    "lastSkippedReason": {
      "type": "string",
      "enum": ["misfire_policy_skip", "concurrency_key_active", "goal_scan_same_day"]
    },
    "lastSkippedConcurrencyKey": { "type": "string" },
    "createdAt": { "type": "string" },
    "updatedAt": { "type": "string" },
    "lastRunAt": { "type": "string" },
    "lastRunTaskId": { "type": "string" },
    "lastRunTeamTaskId": { "type": "string" },
    "lastRunTeamRunId": { "type": "string" },
    "lastRunStatus": { "type": "string", "enum": ["started", "failed", "skipped"] },
    "lastRunError": { "type": "string" },
    "lastDispatchStatus": {
      "type": "string",
      "enum": ["dispatched", "waiting_user_confirm", "skipped", "failed"]
    },
    "lastDispatchError": { "type": "string" },
    "goalDailyScan": {
      "type": "object",
      "description": "Optional goal.cron_scan payload shape used by the daily Goal scan helper.",
      "properties": {
        "goalType": { "type": "string" },
        "action": { "type": "string" },
        "timezone": { "type": "string" }
      },
      "additionalProperties": true
    }
  }
}
